{
  "schemaVersion": 1,
  "projectId": "ium-lernwerk",
  "asOf": "2026-09-03",
  "scope": {
    "grades": [5, 6, 7],
    "schoolType": "Gymnasium Baden-Württemberg",
    "level": "E",
    "maturity": "working",
    "contentProduction": "frozen",
    "productBinding": "product-neutral"
  },
  "policies": {
    "universalPageTemplate": false,
    "universalElementLimit": false,
    "universalMinuteLimit": false,
    "decorativeGamificationDefault": false,
    "productComponentsAllowed": false,
    "learnerFacingContentAllowed": false
  },
  "patterns": [
    {
      "id": "LXF05-PT-001",
      "family": "entry-and-orientation",
      "title": "Zielklarer Einstieg mit aufgabenbezogenem Ausgangsprodukt",
      "learnerPurpose": "Ziel, Zweck, erwartete fachliche Handlung und ersten Schritt erkennen und eine aufgabenbezogene Ausgangsvorstellung sichtbar machen.",
      "teacherPurpose": "Unterschiedliche Ausgangslagen an einem kleinen fachlichen Produkt erkennen und den nächsten Übergang begründet wählen.",
      "learningFunctionIds": ["orient", "surface-prior-knowledge"],
      "principleIds": ["LXF04-PR-001", "LXF04-PR-002", "LXF04-PR-003", "LXF04-PR-016", "LXF04-PR-018"],
      "applicability": {
        "useWhen": [
          "Der Lernbogen neu beginnt oder nach einer Unterbrechung wieder aufgenommen wird.",
          "Das folgende Lernen an einer begrenzten Ausgangsvorstellung oder einem relevanten Vorwissen anschließt."
        ],
        "doNotUseWhen": [
          "Eine unverbindliche Stimmungsfrage keinen fachlichen Anschluss steuert.",
          "Die Lehrkraft aus der Einzelantwort eine stabile Personen- oder Defizitdiagnose ableiten müsste."
        ]
      },
      "requiredElements": [
        "Fachlicher Zielzustand und Zweck des entstehenden Produkts",
        "Sichtbarer erster Schritt ohne Suche in einer Produktoberfläche",
        "Kleines Ausgangsprodukt mit dokumentierter Anschlussentscheidung"
      ],
      "forbiddenElements": [
        "Pflicht zur persönlichen oder öffentlichen Selbstauskunft",
        "Dekorative Begrüßung ohne Lernfunktion",
        "Vollständiger Lernendenpfad als starre Vorabnavigation"
      ],
      "observableChecks": [
        "Ziel, erste Handlung und erwartetes Produkt benennen dieselbe fachliche Beziehung.",
        "Für unterscheidbare Produktlagen sind passende Anschlussoptionen beschrieben."
      ],
      "verificationMethods": ["expert-review", "content-walkthrough", "classroom-pilot"],
      "accessibilityConsiderations": [
        "Ziel, Status und erster Schritt sind textlich und nicht nur über Farbe, Position oder Symbolik erkennbar.",
        "Das Ausgangsprodukt kann ohne persönliche Offenlegung und über mindestens einen gleichwertigen Ausdrucksweg entstehen."
      ],
      "productDependencies": [],
      "quantifiedRules": [],
      "status": "working"
    },
    {
      "id": "LXF05-PT-002",
      "family": "worked-example-with-active-processing",
      "title": "Bearbeitetes Beispiel mit Entscheidungs- und Begründungsstopps",
      "learnerPurpose": "Eine fachliche Vorgehensweise an einem sichtbaren Modell nachvollziehen, vorhersagen, begründen und in einen eigenen nahen Schritt überführen.",
      "teacherPurpose": "Fehlende Begriffe, Beziehungen oder Verfahrensschritte erkennen, ohne ein beobachtetes Beispiel mit eigenständiger Anwendung zu verwechseln.",
      "learningFunctionIds": ["explain-or-model", "guided-action", "independent-application"],
      "principleIds": ["LXF04-PR-004", "LXF04-PR-007", "LXF04-PR-009", "LXF04-PR-011", "LXF04-PR-013"],
      "applicability": {
        "useWhen": [
          "Ein neuer, mehrschrittiger oder fehleranfälliger Zusammenhang explizite Modellierung benötigt.",
          "Das Beispiel durch Vorhersage, Selbstklärung oder einen unvollständigen Schritt aktiv verarbeitet werden kann."
        ],
        "doNotUseWhen": [
          "Ein vollständiges Muster nur kopiert oder passiv abgespielt werden soll.",
          "Der fachliche Kern bereits sicher beherrscht wird und das Beispiel eigenständiges Denken unnötig ersetzt."
        ]
      },
      "requiredElements": [
        "Sichtbarer Bezug zwischen Entscheidung, fachlicher Begründung und Ergebniszustand",
        "Aktiver Verarbeitungsstopp vor oder innerhalb eines Kernschritts",
        "Unmittelbare Anwendung ohne vollständige Vorlage"
      ],
      "forbiddenElements": [
        "Automatisches Durchklicken als aktive Verarbeitung",
        "Gleichzeitige Vollvorlage während der eigenständigen Anwendung",
        "Erfolgsaussage allein aus dem Nachvollziehen des Beispiels"
      ],
      "observableChecks": [
        "Mindestens ein Kernschritt wird vor dem Anzeigen vorhergesagt, begründet oder ergänzt.",
        "Die anschließende Anwendung erzeugt einen eigenständigen fachlichen Kernschritt."
      ],
      "verificationMethods": ["expert-review", "content-walkthrough", "classroom-pilot"],
      "accessibilityConsiderations": [
        "Schritt, Zustand und Begründung bleiben auch ohne Animation oder Audio nachvollziehbar.",
        "Aktive Stopps sind per Tastatur, Touch und Textalternative erreichbar."
      ],
      "productDependencies": [],
      "quantifiedRules": [],
      "status": "working"
    },
    {
      "id": "LXF05-PT-003",
      "family": "linked-representations-and-signaling",
      "title": "Fachlich verknüpfte Repräsentationen mit sparsamen Signalen",
      "learnerPurpose": "Zusammengehörige Elemente in Text, Bild, Code, Modell, Tabelle oder Zustand erkennen und ihre Beziehung erklären.",
      "teacherPurpose": "Prüfen, ob Darstellungen dieselbe fachliche Beziehung kohärent tragen oder vermeidbare Such- und Übersetzungsarbeit erzeugen.",
      "learningFunctionIds": ["explain-or-model", "guided-action"],
      "principleIds": ["LXF04-PR-004", "LXF04-PR-006", "LXF04-PR-008", "LXF04-PR-017"],
      "applicability": {
        "useWhen": [
          "Mehrere Repräsentationen für das Verständnis einer fachlichen Beziehung erforderlich sind.",
          "Ein Signal eine konkrete Zuordnung, Veränderung oder Abhängigkeit sichtbar machen kann."
        ],
        "doNotUseWhen": [
          "Eine zweite Darstellung nur dekorativ oder redundant hinzukommt.",
          "Farbe, Bewegung oder räumliche Nähe ohne benennbare fachliche Beziehung eingesetzt werden."
        ]
      },
      "requiredElements": [
        "Konsistente Begriffe und Zustandsbezeichner über alle Darstellungen",
        "Räumlich oder textlich auffindbare Verbindung zusammengehöriger Elemente",
        "Legende oder Beschriftung für jedes fachlich relevante Signal"
      ],
      "forbiddenElements": [
        "Dekorative Hervorhebung ohne fachlichen Referenten",
        "Widersprüchliche Zustände oder Bezeichnungen zwischen Darstellungen",
        "Verständnisabhängigkeit von Farbe allein"
      ],
      "observableChecks": [
        "Für jedes Signal lässt sich die markierte fachliche Beziehung benennen.",
        "Eine fachkundige Person kann zusammengehörige Elemente ohne Wechsel in eine nicht sichtbare Ansicht zuordnen."
      ],
      "verificationMethods": ["expert-review", "content-walkthrough", "accessibility-audit", "usability-test"],
      "accessibilityConsiderations": [
        "Zuordnungen besitzen textliche, strukturelle oder formbezogene Hinweise zusätzlich zu Farbe.",
        "Zeitabhängige Veränderungen lassen sich anhalten, schrittweise prüfen oder in einer statischen Alternative nachvollziehen."
      ],
      "productDependencies": [],
      "quantifiedRules": [],
      "status": "working"
    },
    {
      "id": "LXF05-PT-004",
      "family": "prediction-execution-comparison",
      "title": "Vorhersagen, ausführen, Zustände vergleichen und revidieren",
      "learnerPurpose": "Eine fachlich begründete Erwartung erzeugen, einen Prozess oder ein Modell ausführen und Abweichungen zur Revision nutzen.",
      "teacherPurpose": "Vorstellungen und Fehlwege an einem sachbezogenen Vergleich sichtbar machen und gezielt an die nächste Erklärung oder Übung anschließen.",
      "learningFunctionIds": ["surface-prior-knowledge", "open-disciplinary-problem", "guided-action", "use-feedback"],
      "principleIds": ["LXF04-PR-003", "LXF04-PR-005", "LXF04-PR-006", "LXF04-PR-009", "LXF04-PR-012"],
      "applicability": {
        "useWhen": [
          "Ein erwarteter und ein beobachtbarer Zustand fachlich sinnvoll verglichen werden können.",
          "Eine Abweichung eine Erklärung, Modellrevision oder Verfahrenskorrektur auslösen kann."
        ],
        "doNotUseWhen": [
          "Die Ausführung nur Überraschung oder Showeffekt erzeugt.",
          "Die Vorhersage ohne Begründung abgefragt und anschließend nicht wieder aufgegriffen wird."
        ]
      },
      "requiredElements": [
        "Gespeicherte oder nebeneinander rekonstruierbare Vorhersage",
        "Beobachtbarer Ausführungs- oder Ergebniszustand",
        "Vergleichsfrage mit fachlicher Revisionshandlung"
      ],
      "forbiddenElements": [
        "Richtig-falsch-Rückmeldung ohne Vergleichsbegründung",
        "Verdeckte Zustandsänderung ohne rekonstruierbare Ursache",
        "Personenbewertung aus einer einzelnen Fehlvorhersage"
      ],
      "observableChecks": [
        "Vorhersage und Ergebnis können auf dieselben Merkmale bezogen verglichen werden.",
        "Eine Abweichung führt sichtbar zu Erklärung, Korrektur oder begründeter Beibehaltung."
      ],
      "verificationMethods": ["content-walkthrough", "usability-test", "classroom-pilot"],
      "accessibilityConsiderations": [
        "Ausgangs- und Ergebniszustand sind textlich unterscheidbar und nicht nur animiert.",
        "Die Revision kann ohne zeitkritische Eingabe oder Drag-and-drop erfolgen."
      ],
      "productDependencies": [],
      "quantifiedRules": [],
      "status": "working"
    },
    {
      "id": "LXF05-PT-005",
      "family": "guided-practice-and-help",